{
  "name": "PyLadies La Paz",
  "city": "La Paz",
  "country": "Bolivia",
  "email": "lp@pyladies.com",
  "website": "https://www.meetup.com/La-Paz-PyLadies-Meetup",
  "photo_url": "https://pyladies.com/assets/images/pyladies_lapaz.png",
  "social_media": {
    "twitter": "https://twitter.com/PyLadiesLaPaz",
    "facebook": "https://facebook.com/PyLadiesLaPaz"
  }
}
