{
  "name": "PyLadies Chicago",
  "city": "Chicago",
  "country": "USA",
  "email": "chicago@pyladies.com",
  "website": "http://chicago.pyladies.com",
  "photo_url": "https://pyladies.com/assets/images/pyladies_chicago.png",
  "social_media": {
    "twitter": "https://twitter.com/PyLadiesChicago",
    "meetup": "https://www.meetup.com/Chicago-PyLadies/"
  }
}
