{
  "name": "PyLadies Chennai",
  "city": "Chennai",
  "country": "India",
  "email": "chn@pyladies.com",
  "photo_url": "https://pyladies.com/assets/images/pyladies_chennai.png",
  "social_media": {
    "github": "https://github.com/pyladieschennai",
    "twitter": "https://twitter.com/pyladieschennai",
    "facebook": "https://facebook.com/pyladiesofchennai",
    "meetup": "https://www.meetup.com/pyladieschennai/"
  }
}
