{
  "name": "PyLadies Pune",
  "city": "Pune",
  "country": "India",
  "email": "pune@pyladies.com",
  "website": "http://pune.pyladies.com/",
  "social_media": {
    "twitter": "https://twitter.com/PyladiesPune",
    "facebook": "https://facebook.com/PyLadiesPune",
    "meetup": "https://www.meetup.com/PyLadies-Pune/"
  }
}