{
  "name": "PyLadies Houston",
  "city": "Houston",
  "country": "USA",
  "email": "Houston.pyladies@gmail.com",
  "photo_url": "https://pyladies.com/assets/images/pylady_geek.png",
  "social_media": {
    "twitter": "https://twitter.com/HPyladies",
    "meetup": "https://www.meetup.com/Houston_PyLadies/"
  }
}
