{
  "name": "PyLadies London",
  "city": "London",
  "country": "United Kingdom",
  "email": "london@pyladies.com",
  "photo_url": "https://pyladies.com/assets/images/pyladies_london.png",
  "social_media": {
    "twitter": "https://twitter.com/PyLadiesLondon",
    "meetup": "https://www.meetup.com/pyladieslondon/"
  }
}
