{
  "name": "PyLadies Los Angeles",
  "city": "Los Angeles",
  "country": "USA",
  "email": "la@pyladies.com",
  "website": "https://pyladiesla.netlify.com/",
  "photo_url": "https://pyladies.com/assets/images/pyladies_la.jpeg",
  "social_media": {
    "twitter": "https://twitter.com/pyladiesLA",
    "meetup": "https://www.meetup.com/Pyladies-LA/"
  }
}
