{
  "name": "PyLadies Milan",
  "city": "Milan",
  "country": "Italy",
  "email": "milan@pyladies.com",
  "social_media": {
    "twitter": "https://twitter.com/@MilanoPyladies",
    "facebook": "https://facebook.com/pg/pyladiesmilan",
    "meetup": "https://www.meetup.com/meetup-group-AmxqeOPN//"
  }
}