{
  "name": "PyLadies Mexico City",
  "city": "Mexico City",
  "country": "Mexico",
  "email": "mx@pyladies.com",
  "photo_url": "https://pyladies.com/assets/images/pyladies_cdmx.png",
  "social_media": {
    "twitter": "https://twitter.com/MxPyladies",
    "meetup": "https://www.meetup.com/Mexico-City-Pyladies-Meetup/"
  }
}
