{
  "name": "PyLadies Athens",
  "city": "Athens",
  "country": "Greece",
  "email": "athens@pyladies.com",
  "social_media": {
    "github": "https://github.com/PyLadies-Athens",
    "linkedin": "https://www.linkedin.com/company/pyladies-athens/",
    "instagram": "https://www.instagram.com/pyladiesathens/"
  }
}