{
  "name": "PyLadies South Florida",
  "city": "South Florida",
  "country": "USA",
  "email": "southflorida@pyladies.com",
  "social_media": {
    "github": "https://github.com/PyLadiesSoFlo",
    "twitter": "https://twitter.com/PyLadiesSoFlo",
    "facebook": "https://facebook.com/PyLadiesSoFlo",
    "meetup": "https://www.meetup.com/PyLadies-SoFlo/"
  }
}