{
  "name": "PyLadies Melbourne",
  "city": "Melbourne",
  "country": "Australia",
  "email": "melbourne@pyladies.com",
  "website": "http://melbourne.pyladies.com/",
  "photo_url": "https://pyladies.com/assets/images/pyladies_melbourne.jpeg",
  "social_media": {
    "github": "https://github.com/pyladiesmelbourne",
    "twitter": "https://twitter.com/PyLadiesMEL",
    "facebook": "https://facebook.com/pyladiesau",
    "meetup": "https://www.meetup.com/PyLadies-Melbourne/"
  }
}
